{
  "$schema": "https://json-schema.org/draft/2020-12/schema",
  "$id": "https://cloud-agent.local/schemas/workflow-run.schema.json",
  "title": "WorkflowRun",
  "description": "Runtime instance of a bundle snapshot. Node business success requires status approved after App review; awaiting_review means code may exist but progress must not advance.",
  "type": "object",
  "additionalProperties": false,
  "required": ["id", "bundleId", "status", "nodes", "createdAt"],
  "properties": {
    "id": { "type": "string", "minLength": 1 },
    "bundleId": { "type": "string", "minLength": 1 },
    "bundleRef": { "type": ["string", "null"] },
    "slaveId": { "type": ["string", "null"] },
    "repoId": { "type": "string" },
    "progressDoc": { "type": ["string", "null"] },
    "status": {
      "type": "string",
      "enum": ["pending", "running", "completed", "failed", "cancelled"]
    },
    "nodes": {
      "type": "array",
      "minItems": 1,
      "items": {
        "type": "object",
        "additionalProperties": false,
        "required": ["id", "status"],
        "properties": {
          "id": { "type": "string" },
          "phaseRef": { "type": ["string", "null"] },
          "title": { "type": ["string", "null"] },
          "dependsOn": {
            "type": "array",
            "items": { "type": "string" }
          },
          "status": {
            "$ref": "workflow-node-status.schema.json"
          },
          "taskId": { "type": ["string", "null"] },
          "unitId": { "type": ["string", "null"] },
          "model": { "type": "string" },
          "policy": {
            "type": "object",
            "additionalProperties": false,
            "description": "Per-node execution policy (M10). Defaults false/false when omitted.",
            "properties": {
              "autoApprove": {
                "type": "boolean",
                "default": false,
                "description": "When true, awaiting_review auto-approves (M10-P03)."
              },
              "autoStartNext": {
                "type": "boolean",
                "default": false,
                "description": "When true, approve triggers AssignWorkflow for ready downstream; otherwise wait for continue/start."
              }
            }
          },
          "dodChecks": {
            "type": "array",
            "items": { "type": "string" }
          },
          "onFailure": {
            "type": "string",
            "enum": ["stop", "skip", "retry"]
          },
          "prompt": {
            "type": "object",
            "additionalProperties": false,
            "properties": {
              "mode": {
                "type": "string",
                "enum": ["phase_file", "inline"]
              },
              "extra": { "type": "string" },
              "inline": { "type": "string" }
            }
          }
        }
      }
    },
    "reviseHistory": {
      "type": "array",
      "description": "Audit log of App revise instructions (never discarded). Revise does not approve or write progress.",
      "items": {
        "type": "object",
        "additionalProperties": false,
        "required": ["nodeId", "instruction", "at"],
        "properties": {
          "nodeId": { "type": "string" },
          "instruction": { "type": "string", "minLength": 1 },
          "at": { "type": "string", "format": "date-time" },
          "taskId": { "type": "string" }
        }
      }
    },
    "createdAt": { "type": "string", "format": "date-time" },
    "updatedAt": { "type": ["string", "null"], "format": "date-time" }
  }
}
